sequence,labels
Lift heavy weights and apply ergonomic lifting techniques to avoid damaging the body.,Others Skills
"Load and unload equipment to be repaired or replaced, new or replacement equipment and transport it towards or from customers.",Others Skills
"Load raw semiconductor materials, such as polysilicon, into furnace. The resulting lake of melted silicon is then spun in a crucible and a silicon seed crystal is put into it while spinning in the opposite direction. When the melted polysilicon is allowed to cool, the seed crystal is slowly withdrawn. The result is a single semiconductor crystal with a diameter of approximately 200 millimeters.",Others Skills
Load transistors and other electronic circuit elements onto the finished silicon wafers and slice wafers into individual integrated circuits (IC's) or microchips.,Technological Skills
"Maintain an overview of all the incoming tasks in order to prioritise the tasks, plan their execution, and integrate new tasks as they present themselves.",Thinking Skills
Maintain required company records and forms in order to report any defective materials or questionable conditions of manufacturing machinery and equipment.,Others Skills
"Make a scale model that represents the vision and specifications of the construction project to allow the design team to review details such as colour and materials selection, and to show and discuss the project with the customers.",Thinking Skills
"Make immediate operating decisions as necessary without reference to others, taking into account the circumstances and any relevant procedures and legislation. Determine alone which option is the best for a particular situation.",Thinking Skills
Make maps by formatting compiled data into a virtual image that gives a precise representation of a specific area.,Digital Skills
Make sure that the measurable factors which define the operation of a system correspond to the predetermined norms.,Technological Skills
"Manage and plan various resources, such as human resources, budget, deadline, results, and quality necessary for a specific project, and monitor the project's progress in order to achieve a specific goal within a set time and budget.",Thinking Skills
"Manage personnel, machinery and equipment in order to optimise production results, in accordance with the policies and plans of the company.",Personal Skills
"Manage the organisational, financial and day-to-day operation of a small-to-medium enterprise.",Thinking Skills
"Manipulate the properties, shape and size of glass.",Technological Skills
"Manipulate the properties, shape and size of metal.",Technological Skills
"Manufacture batteries for motor vehicles by using hand tools, power tools or automated machines. Read and understand blueprints and technical plans to comprehend specifications and requirements.",Technological Skills
"Manufacture batteries using hand tools, power tools or automated machines. Understand and read plans and blueprints regarding the technical aspects of batteries to comprehend specifications and requirements.",Technological Skills
Master foreign languages to be able to communicate in one or more foreign languages.,Personal Skills
"Measure voltage, current, resistance or other electrical characteristics by using electrical measuring equipment such as multimeters, voltmeters, and ammeters.",Technological Skills
"Model and simulate an electrical system, product, or component so that an assessment can be made of the viability of the product and so the physical parameters can be examined before the actual building of the product.",Technological Skills
"Model and simulate an electromechanical system, product, or component so that an assessment can be made of the viability of the product and so the physical parameters can be examined before the actual building of the product.",Technological Skills
Model and simulate computer hardware using technical design software. Assess the viability of the product and examine the physical parameters to ensure a successful production process.,Technological Skills
"Model and simulate microelectronic systems, products, and components using technical design software. Assess the viability of the product and examine the physical parameters to ensure a successful production process.",Technological Skills
"Model and simulate optical systems, products, and components using technical design software. Assess the viability of the product and examine the physical parameters to ensure a successful production process.",Technological Skills
Monitor and govern the pyrometer to control the furnace temperature.,Technological Skills
Monitor the product temperature using the available tools and measuring instruments and adjust furnace temperature if needed.,Technological Skills
"Mount the components present in the body of the camera, such as the shutter, mirror, flash bulb, image processor, display screen, battery, pentaprism, viewfinder, and image sensor, as well as the lens of the camera. Lenses are mechanically set into place using threaded retaining rings and the use of adhesive cement on the outer cylindrical edge to hold lenses in place.",Technological Skills
"Observe and identify various kinds of imperfections in metal workpieces or finished products. Recognise the best fitted manner of fixing the problem, which could be caused by corrosion, rust, fractures, leaks, and other signs of wear.",Others Skills
"Observe and listen to machinery operation to detect malfunction. Service, repair, adjust, and test machines, parts, and equipment that operate primarily on the basis of mechanical principles. Maintain and repair vehicles meant for cargo, passengers, farming and landscaping.",Others Skills
Observe machine operations and evaluate product quality thereby ensuring conformity to standards.,Thinking Skills
"Observe principles in keeping an engineering watch. Take over, accept and hand over a watch. Perform routine duties undertaken during a watch. Maintain the machinery space logs and the significance of the readings taken. Observe safety and emergency procedures. Observe safety precautions during a watch and take immediate actions in the event of fire or accident, with particular reference to oil systems.",Others Skills
"Operate a semi-automated, semi-manual drill press to drill holes in a work piece, safely and according to regulations.",Technological Skills
"Operate and adjust measuring instruments such as theodolites and prisms, and other electronic distance-measuring tools.",Technological Skills
"Operate and maintain grade crossing warning systems, signals and railroad signal equipment such as hot box detectors and interlocks.",Technological Skills
"Operate and use soldering tools and soldering iron, which supply high temperatures to melt the solder and to join electronic components.",Technological Skills
Operate cutting and measuring instruments in order to cut/shape pieces of metal into given dimensions.,Technological Skills
"Operate devices, machinery, and equipment designed for scientific measurement. Scientific equipment consists of specialised measuring instruments refined to facilitate the acquisition of data.",Technological Skills
"Operate equipment used for battery testing, such as a soldering iron, a battery tester, or a multimeter. Detect flaws affecting the battery's performance, test the battery's capacity for accumulating charge, or test its voltage output.",Technological Skills
"Operate machinery for various types of printed documents, adjusting the font, paper size, and weight. This allows ascenders and descenders to be correctly placed.",Technological Skills
Operate machinery used for the making of small systems or components with a high level of precision.,Technological Skills
Operate measurement instruments to measure parts of manufactured objects. Take into consideration specifications of manufacturers to perform the measuring.,Technological Skills
"Operate optical measuring equipment to take client's measurements; determine bridge and eye size, papillary distance, vertex distance, optical eye centres, etc., in order to manufacture customised eyeglasses or contact lenses.",Technological Skills
Operate power driven pumps. Use hand tools or power tools. Use vehicle repair tools or safety equipment.,Others Skills
Operate railway communication systems; make announcements over the public address system or communicate with central train administration.,Technological Skills
"Operate robotic machines to clean, buff, and polish the wafers using a process called lapping. The result is wafers of silicon with a surface roughness of less than one millionth of a millimeter.",Technological Skills
Operate surface-mount technology (SMT) machines and equipment to place and solder surface-mount devices (SMD) onto the printed circuit board with high precision.,Technological Skills
Operate the insertion mount machine or inserter to insert the leads of electronic components into holes in the printed circuit boards.,Technological Skills
"Operate the wave soldering machine to solder electronic components onto the printed circuit board. Here, the board is moved over a wave of liquid solder and the connections inserted through the board are bonded firmly to the circuit board.",Technological Skills
"Operate various types of railway control panels such as Individual Function Switch (IFS), One Control Switch (OCS) or Entrance Exit (NX).",Technological Skills
Operate wire saw machines to slice the silicon crystals into ultra thin wafers of approximately 2/3 millimeters thick.,Technological Skills
"Order optical equipment and materials, paying attention to the price, quality, and suitability of the supplies.",Others Skills
"Order the required materials for assembling electronic equipment, paying attention to the price, quality, and suitability of the materials.",Others Skills
Organise tasks according to their priority.,Others Skills
Organise the process of writing and designing proposals or bids for tenders.,Others Skills
"Outline and design airports, public transport systems and highways in order to assess how to move people and goods in a safe and efficient manner.",Thinking Skills
Oversee distribution channels with regards to the requirements of customers.,Thinking Skills
Oversee production processes and prepare all the resources needed to maintain an efficient and continuous flow of production.,Thinking Skills
"Pass on knowledge and skills, explain and demonstrate the application of equipment and materials and answer questions about trade techniques for the manufacturing of products.",Thinking Skills
Perform cleaning routines after equipment use.,Others Skills
"Perform duties which require particular technical skills such as testing new measuring instruments, developing a program for numerically controlled machines or realising delicate manual work.",Technological Skills
Perform examinations and tests on all kinds of metals in order to ensure high quality and chemical resistance.,Others Skills
Perform non-destructive testing on civil structures such as bridges and pipelines in order to find abnormalities or damage.,Others Skills
"Perform regular maintenance, possibly including corrections and alterations, on a machine or machine tool to ensure it remains in a proper productive state.",Others Skills
"Perform routine maintenance tasks on audiovisual equipment as well as minor repairs, such as replacing parts and calibrating the instruments, on equipment used in processing sound and images.",Others Skills
Place electrical circuits and wiring in vehicles such as lighting and voltage gauges. These distribute and regulate electrical power and supply it to meters and other devices in the car.,Technological Skills
"Place electrically operated accessories in vehicles such as batteries which power heating systems, radios and anti-theft systems.",Technological Skills
"Plan, coordinate and supervise engineering activities together with engineers and engineering technicians. Ensure clear and effective channels of communication across all departments. Make sure the team is aware of the standards and objectives of the research and development.",Personal Skills
"Plan, deploy, troubleshoot and test low voltage wiring.",Technological Skills
"Prepare and apply coating, such as conformal coating, to electrical equipment and its components to protect the equipment against moisture, high temperature, and dust.",Others Skills
"Prepare documentation for existing and upcoming products or services, describing their functionality and composition in such a way that it is understandable for a wide audience without technical background and compliant with defined requirements and standards. Keep documentation up to date.",Others Skills
Prepare early models or prototypes in order to test concepts and replicability possibilities. Create prototypes to assess for pre-production tests.,Others Skills
"Prepare metal or other material workpieces for joining processes by cleaning the workpieces, checking their measurements with the technical plan and marking on the pieces where they'll be joined.",Others Skills
Prepare product for shipment as scheduled.,Others Skills
"Prepare technical reports that describe results and processes of scientific or technical research, or assess its progress. These reports help researchers to keep up to date with recent findings.",Thinking Skills
"Prepare the invoice of goods sold or services provided, containing individual prices, the total charge, and the terms. Complete order processing for orders received via telephone, fax and internet and calculate the customerâs final bill.",Others Skills
Prepare the loaded printed circuit boards for solder operations. Clean the board and mark designated areas.,Technological Skills
"Prepare, compile and communicate reports with broken down cost analysis on the proposal and budget plans of the company. Analyse the financial or social costs and benefits of a project or investment in advance over a given period of time.",Thinking Skills
Produce radiographic images to detect flaws in objects.,Digital Skills
"Program permanent software with a read-only memory (ROM) on a hardware device, such as an integrated circuit.",Programming Skills
"Promote and enforce safety procedures and EU regulations to ensure that railway safety is generally maintained and continuously improved, taking into consideration the development of European legislation.",Social Skills
ProofreadÂ and give feedback to technical drawings or drafts.,Thinking Skills
Provide advice on and test a wide range of construction materials.,Thinking Skills
"Provide advice on architectural design, based on knowledge of matters such as spatial division, balance of construction elements, and aesthetics.",Thinking Skills
Provide advice on building matters to the various parties involved in construction projects. Bring to their awareness important building considerations and consult on construction budgets.,Social Skills
"Provide customers with information about office equipment and instruct them on how to use equipment such as printers, scanners and modems.",Social Skills
"Provide support and advice to customers in making purchasing decisions by finding out their needs, selecting suitable service and products for them and politely answering questions about products and services.",Social Skills
Put system design and technical specifications in line with software architecture in order to ensure the integration and interoperability between components of the system.,Digital Skills
"Reach an agreement with theÂ supplier upon technical, quantity, quality, price, conditions, storage, packaging, send-back and other requirements related to the purchasing and delivering process.",Personal Skills
Reach out to and meet up with people in a professional context. Find common ground and use your contacts for mutual benefit. Keep track of the people in your personal professional network and stay up to date on their activities.,Social Skills
Read and comprehend blueprints and electrical diagrams; understand technical instructions and engineering manuals for assembling electrical equipment; understand electricity theory and electronic components.,Technological Skills
"Read and comprehend circuit plans during initial construction, during troubleshooting, maintenance, and testing activities and while repairing or replacing components.",Technological Skills
Read and interpret drawings listing all the parts and subassemblies of a certain product. The drawing identifies the different components and materials and provides instructions on how to assemble a product.,Technological Skills
"Receive incoming electronics supplies, handle the transaction and enter the supplies into any internal administration system.",Others Skills
"Recognise the symptoms of metal showing oxidation reactions with the environment resulting in rusting, copper pitting, stress cracking, and others, and estimate the rate of corrosion.",Thinking Skills
"Recommend technical solutions, including systems, to the client within the framework of a project.",Technological Skills
Regularly inspect and perform all required activities to maintain the equipment in functional order prior or after its use.,Technological Skills
"Regulate and monitor the manufacturing equipment settings and process parameters, such as its temperature and power level. Review the manufacturing process and equipment and suggest improvements.",Others Skills
Remove defective materials from the production line.,Others Skills
Remove defective parts and replace them with functioning components.,Others Skills
"Repair battery components through replacing cells, repairing wiring, or spot-welding cells.",Others Skills
"Repair, replace or adjust damaged electronics components or circuitry; use hand tools and soldering and welding equipment.",Technological Skills
Reply to private consumer requests according to REACh Regulation 1907/2006 whereby chemical Substances of Very High Concern (SVHC) should be minimal. Advise customers on how to proceed and protect themselves if the presence of SVHC is higher than expected.,Social Skills
"Report on the instrument calibration measurements and results. A calibration report includes the objectives and approach of the test, descriptions of tested instruments or products, test procedures, and test results.",Thinking Skills
"Report test results with a focus on findings and recommendations, differentiating results by levels of severity. Include relevant information from the test plan and outline the test methodologies, using metrics, tables, and visual methods to clarify where needed.",Others Skills
"Research equipment or required machine parts; compare sources, prices and delivery times.",Thinking Skills
Restore old musical instruments to their original condition and conserve them in that state.,Others Skills
"Revise quality control documents. Read through the documents, editing them, and revise items in the documentation like the numbering scheme, process to create new documents, revision and follow up process, closure of non-conformities, methods for tracking documents, etc.",Thinking Skills
Rewire any lose wiring or solder any loose ends of electronic musical instruments.,Technological Skills
Safely pack sensitive electronic equipment for storage and transport.,Others Skills
"Schedule and perform regular maintenance, cleaning, and repairs of all equipment. Order necessary machine parts and upgrade equipment when necessary to ensure optimal performance.",Others Skills
"Select and apply appropriate restoration techniques in order to achieve the required restoration goals. This encompasses preventive measures, remedial measures, restoration processes and management processes.",Thinking Skills
"Sell electronic consumer goods such as TVs, radios, cameras and other audio and video equipment. Provide advice on purchase decisions and try to meet customers wishes. Process payments.",Others Skills
"Sell office equipment such as modems, computer hardware or printers. Provide advice on purchase decisions and try to meet customers wishes. Process payments.",Others Skills
"Set up a list of materials, components, and assemblies as well as the quantities needed to manufacture a certain product.",Others Skills
Set up and configure devices which enhance strength of signal of a communication channel to enable proper reception and reproduction in further places.,Technological Skills
Set up and deploy digital and analogue electronic communications. Understand electronic diagrams and equipment specifications.,Technological Skills
Set up and give commands to a machine by dispatching the appropriate data and input into the (computer) controller corresponding with the desired processed product.,Programming Skills
"Set up and operate optical processing or assembly equipment, such as optical spectrum analysers, power saws, lasers, die bonders, soldering irons, and wire bonders.",Technological Skills
"Set up and operate radio devices and accessories, such as broadcast consoles, amplifiers, and microphones. Understand the basics of radio operator language and, when necessary, provide instruction in handling radio equipment correctly.",Others Skills
"Show the ability to pursue basic manual tasks without the help or assistance of others, not needing supervision or guidance, and taking responsibility for one's actions.",Personal Skills
"Smooth glass or lens surfaces of optical instruments with grinding and polishing tools, such as diamond tools.",Others Skills
Solder electronic components onto bare electronic boards to create loaded electronic boards using hand soldering tools or soldering machinery.,Others Skills
"Specify the criteria by which data quality is measured for business purposes, such as inconsistencies, incompleteness, usability for purpose and accuracy.",Digital Skills
Study the requirements on the transmission capacity of an ICT network or other telecommunication system.,Technological Skills
"Take and prepare samples for testing, verify their representability; avoid bias and any possibility of accidental or deliberate contamination. Provide clear numbering, labelling and recording of the sample details, in order to make sure that the results can be accurately matched to the original material.",Others Skills
Take the necessary precautions while providing temporary power distribution independently. Measure and power up an installation.,Others Skills
"Tend a wide variety of devices for measuring electronic characteristics of system components, such as optical power meter, fibre power meter, digital power meter and multimeter.",Technological Skills
"Test computer hardware systems and components using appropriate equipment and testing methods, such as the system test (ST), the ongoing reliability test (ORT), and the in-circuit test (ICT). Monitor and evaluate system performance and take action if needed.",Technological Skills
"Test electrical equipment for malfunctions. Take safety measures, company guidelines, and legislation concerning electrical equipment into account. Clean, repair and replace parts and connections as required.",Others Skills
"Test electrical systems, machines, and components and check electrical properties, such as voltage, current, resistance, capacitance, and inductance, using electrical testing and measuring equipment, such as a multimeter. Gather and analyse data. Monitor and evaluate system performance and take action if needed.",Technological Skills
Test electronic units using appropriate equipment. Gather and analyse data. Monitor and evaluate system performance and take action if needed.,Technological Skills
Test microelectronics using appropriate equipment. Gather and analyse data. Monitor and evaluate system performance and take action if needed.,Technological Skills
"Test optical systems, products, and components with appropriate optical testing methods, such as axial ray testing and oblique ray testing.",Technological Skills
Test processed workpieces or products for basic faults.,Thinking Skills
"Test the printed circuit board with special testing adapters to ensure optimal efficiency, functionality, and that everything works according to design. Adapt the testing devices to the type of circuit board.",Thinking Skills
"Test, operate, and maintain railway signalling equipment such as power switches and grade crossing warning devices.",Technological Skills
"Transfer tools, materials and equipment to warehouse locations for shipping.",Others Skills
Transpose a series of requirements into a clear and organised software design.,Thinking Skills
Undertake safety inspections in areas of concern to identify and report potential hazards or security breaches; take measures to maximise safety standards.,Others Skills
"Use diagnostic equipment to measure current, resistance and voltage. Handle sophisticated multimeters to measure inductance, capacitance and current transistor gain.",Technological Skills
"Use different measurement instruments depending on the property to be measured. Utilise various instruments to measure length, area, volume, speed, energy, force, and others.",Thinking Skills
"Use electronic, mechanical, electric, or optical precision tools for precision work.",Digital Skills
"Use glass cutting tools or diamond blades to cut pieces out of glass plates, including mirrors.",Others Skills
"Use graphical ICT tools, such as Autodesk Maya, Blender which enable digital editing, modelling, rendering and composition of graphics. These tools are based in mathematical representation of three-dimensional objects.",Others Skills
Use infrared techniques to discover defects in concrete.,Technological Skills
"Use of a variety of specialised tools, instruments and machines, such as presses, drills and grinders; employ them to carry out repairs in a safety manner.",Technological Skills
