sequence,labels
Adjust work schedule in order to maintain permanent shift operation.,Others Skills
"Analyse the ability of products to endure stress imposed by temperature, loads, motion, vibration and other factors, by using mathematical formulas and computer simulations.",Digital Skills
Apply mathematical methods and make use of calculation technologies in order to perform analyses and devise solutions to specific problems.,Technological Skills
Create rough pictures to assist in creating and communicating design concepts.,Others Skills
Data entry software.,Digital Skills
"Draft sketches and design electromechanical systems, products, and components using Computer Aided Design (CAD) software and equipment.",Digital Skills
Ensure operative processes are finished at a previously agreed-upon time.,Others Skills
"Ensure that the necessary equipment is provided, ready and available for use before start of procedures.",Others Skills
"Estimate the expected input in terms of time, human and financial resources necessary to achieve the project objectives.",Others Skills
"Estimate the operating cost in terms of manpower, consumables and maintenance.",Others Skills
"Gather, assess and represent data about target market and customers in order to facilitate strategic development and feasibility studies. Identify market trends.",Digital Skills
"Guarantee compliance with established and applicable standards and legal requirements such as specifications, policies, standards or law for the goal that organisations aspire to achieve in their efforts.",Others Skills
"Hire new employees by scoping the job role, advertising, performing interviews and selecting staff in line with company policy and legislation.",Others Skills
Lead and manage according to the organisation's code of conduct.,Personal Skills
"Maintain records of the progress of the work including time, defects, malfunctions, etc.",Others Skills
"Make use of various types of communication channels such as verbal, handwritten, digital and telephonic communication with the purpose of constructing and sharing ideas or information.",Others Skills
"Monitor and control the flow of supplies that includes the purchase, storage and movement of the required quality of raw materials, and also work-in-progress inventory. Manage supply chain activities and synchronise supply with demand of production and customer.",Others Skills
"Register, follow-up, solve and respond to customer requests, complaints and after-sales services.",Social Skills
"Respond to and communicate with customers in the most efficient and appropriate manner to enable them to access the desired products or services, or any other help they may require.",Social Skills
Take action on the goals and procedures defined at a strategic level in order to mobilise resources and pursue the established strategies.,Personal Skills
Understanding the implications of new information for both current and future problem-solving and decision-making.,Personal Skills
"Use computer-aided design (CAD) systems to assist in the creation, modification, analysis, or optimisation of a design.",Digital Skills
Use computer-aided design and drafting software to make detailed drawings and blueprints of designs.,Digital Skills
Use computer-aided engineering software to conduct stress analyses on engineering designs.,Digital Skills
"Use diagnostic equipment to perform test on motor vehicles, components and systems to detect defects.",Technological Skills
Use specialised tools to convert 3D wire frame models into 2D images with 3D photorealistic effects or non-photorealistic rendering on a computer.,Digital Skills
"Write records of the repairs and maintenance interventions undertaken, of parts and materials used, and other repair facts.",Others Skills
Act as the person to be contacted when an equipment incident occurs. Participate in the investigation by providing insights.,Others Skills
Adhere to organisational or department specific standards and guidelines. Understand the motives of the organisation and the common agreements and act accordingly.,Social Skills
"Adhere to the Control of Substances Hazardous to Health (COSHH) procedures for activities that involve hazardous substances, such as bacteria, allergens, waste oil, paint or brake fluids that result in illness or injury.",Social Skills
Advise the visited industrial plants on how to better oversee production to ensure that the manufacturing problems are correctly diagnosed and solved.,Personal Skills
Analyse production processes leading toward improvement. Analyse in order to reduce production losses and overall manufacturing costs.,Thinking Skills
"Analyse the principles that need to be considered for engineering designs and projects such as functionality, replicability, costs and other principles.",Thinking Skills
"Apply motor oil to engines to lubricate internal combustion engines in order to reduce wear, to clean and to cool the engine.",Others Skills
Apply statistical methods from Design of Experiments (DOE) and Statistical Process Control (SPC) in order to control manufacturing processes.,Technological Skills
Arrange goods in attractive and safe way. Set up a counter or other display area where demonstrations take place in order to attract the attention of prospective customers. Organise and maintain stands for merchandise display. Create and assemble sales spot and product displays for sales process.,Others Skills
"Communicates production plan to all levels in a way that targets, processes, and requirements are clear. Ensures that information is passed to everyone involved in the process assuming their responsibility for overall success.",Social Skills
Coordinate all export transportation operations while considering export strategies and services.,Personal Skills
Create a mathematical or three-dimensional computer graphic model of the product by using a CAE system or a calculator.,Technological Skills
"Develop, document and implement traffic and workflow processes across the company for different functions. Liaise with several departments and services such as account management and the creative director to plan and resource work.",Others Skills
"Ensure a high standard of safety and quality in facilities, systems, and workers' behaviour. Ensure adherence to procedures and audit standards. Ensure that machinery and appliances in the production plant are appropriate for their task.",Others Skills
Ensure compliance with airport security measures prior to the boarding of planes.,Others Skills
"Ensure that goods are labeled with all necessary labeling information (e.g. legal, technological, hazardous and others) regarding the product. Ensure that labels respects the legal requirements and adhere to regulations.",Others Skills
"Evaluate and identify staffing gaps in quantity, skills, performance revenue and surpluses.",Others Skills
"Evaluate the need for labour for the work ahead. Evaluate the performance of the team of workers and inform superiors. Encourage and support the employees in learning, teach them techniques and check the application to ensure product quality and labour productivity.",Social Skills
Follow up on the maintenance and repairs to be carried out. Solve minor problems and pass harder problems on to the person responsible for maintenance.,Personal Skills
Identify shoplifters and methods by which shoplifters try to steal. Implement anti-shoplifting policies and procedures to protect against theft.,Others Skills
Inspect plants where motor vehicles are manufactured to ensure safety and quality control. Ensure that components are manufactured in compliance with safety and design specifications.,Social Skills
Keep firefighting vehicles ready for use at any time. Maintain all aspects of firefighting vehicles and ensure that vehicles function correctly.,Others Skills
"Keep sweepers, mowers, and other airport maintenance equipment ready for use in order to remove contaminants from aircraft operating areas and to ensure the height of grass on unpaved areas meets regulations.",Others Skills
Keep the store tidy and clean by hovering and mopping.,Others Skills
Lead and guide employees through a process in which they are taught the necessary skills for the perspective job. Organise activities aimed at introducing the work and systems or improving the performance of individuals and groups in organisational settings.,Personal Skills
Manage airport workshops to organise operations and ensure completion of all necessary tasks. Prepare maintenance activities according to the requirements and needs of the airport.,Others Skills
"Manage employees and subordinates, working in a team or individually, to maximise their performance and contribution. Schedule their work and activities, give instructions, motivate and direct the workers to meet the company objectives. Monitor and measure how an employee undertakes their responsibilities and how well these activities are executed. Identify areas for improvement and make suggestions to achieve this. Lead a group of people to help them achieve goals and maintain an effective working relationship among staff.",Personal Skills
Manage the licences of vehicles that are permitted to operate inside airports. Know the specifications of these vehicles and ensure they meet licencing requirements.,Others Skills
"Measure the size of a processed part when checking and marking it to check if it is up to standard by use of two and three dimensional precision measuring equipment such as a caliper, a micrometer, and a measuring gauge.",Others Skills
"Monitor activities and perform tasks ensuring compliance with standards involving environmental protection and sustainability, and amend activities in the case of changes in environmental legislation. Ensure that the processes are compliant with environment regulations and best practices.",Others Skills
Monitor and assure the quality of the provided goods or services by overseeing that all the factors of the production meet quality requirements. Supervise product inspection and testing.,Others Skills
"Monitoring and maintaining effective cost controls, in regards to efficiencies, waste, overtime and staffing. Assessing excesses and strives for efficiency and productivity.",Others Skills
Operate testbeds which are designed to assist in the process of testing new equipment or engines. Control testbeds to facilitate the testing of engines or machinery under maintenance conditions.,Technological Skills
Oversee fuel deliveries to service station.,Others Skills
"Oversee maintenance activities, making sure that staff is following procedures and ensuring routine and periodic refurbishment and maintenance activities.",Others Skills
Perform safety audits and inspections on workplaces and workplace equipment. Ensure that they meet safety regulations and identify hazards and risks.,Social Skills
"Perform the evaluation and assessment of the potential of a project, plan, proposition or new idea. Realise a standardised study which is based on extensive investigation and research to support the process of decision making.",Personal Skills
Prepare and distribute documentation to ensure all people involved in the production receive relevant and up-to-date information.,Social Skills
Provide suitable advice and assistance so that customers find the exact goods and services they were looking for. Discuss product selection and availability.,Personal Skills
Refill shelves with merchandise to be sold.,Others Skills
Repair and perform routine maintenance on equipment and systems in power plants to ensure that everything functions safely and is compliant with legislation.,Technological Skills
"Resolve customer inquiries for returns, exchange of merchandise, refunds or bill adjustments. Follow organisational guidelines during this process.",Social Skills
"Revise and analyse financial information and requirements of projects such as their budget appraisal, expected turnover, and risk assessment for determining the benefits and costs of the project. Assess if the agreement or project will redeem its investment, and whether the potential profit is worth the financial risk.",Others Skills
"Spot threats related to security at the airport and apply procedures to counteract them in a quick, safe, and efficient way.",Others Skills
"Study, implement, and monitor the integrity and compliance of products with the required regulatory aspects by law. Advise on applying and abiding by regulations on the product and manufacturing regulations.",Social Skills
Take in of purchase requests for items that are currently unavailable.,Others Skills
Test the suitability of vehicles following maintenance. Ensure that all security and manufacturer specifications have been met before releasing the vehicles to operations in airports.,Others Skills
"Understanding of electrical circuits and being able to repair. Test and replace electrical components and wiring, using test meters, soldering equipment, and hand tools.",Technological Skills
Understanding written sentences and paragraphs in work related documents.,Others Skills
"Use non-computerised draughting techniques to make detailed drawings of designs by hand with specialised tools such as pencils, rulers and templates.",Others Skills
"Use soldering equipment, such as a soldering gun, a soldering torch or a gas-powered iron, to melt and join together pieces of metal or steel.",Technological Skills
"Use various techniques to ensure the product quality is respecting the quality standards and specifications. Oversee defects, packaging and sendbacks of products to different production departments.",Social Skills
"Conduct employee recruitment, helping employees to develop their personal and organisational skills, knowledge, and competencies as well as providing feedback and performance appraisals. It includes motivating employees, by implementing rewarding systems (managing pay and benefit systems) in order to maximise employee performance with regard to employer's strategic objectives.",Others Skills
Deliver thoughts and ideas in impactful and influencing manner to persuade customers to become interested in new products and promotions. Persuade clients that a product or service will satisfy their needs.,Personal Skills
"Giving full attention to what other people are saying, taking time to understand the points being made, asking questions as appropriate, and not interrupting at inappropriate times.",Personal Skills
"Issue official documentation which grants licence holders with official permission to perform certain activities, after having investigated the application and processed the necessary documentation.",Others Skills
Practise reasoning and apply simple or complex numerical concepts and calculations.,Thinking Skills
"Solve problems which arise in planning, prioritising, organising, directing/facilitating action and evaluating performance. Use systematic processes of collecting, analysing, and synthesising information to evaluate current practice and generate new understandings about practice.",Personal Skills
Develop a code of letters and numbers to label diagrams for assembly instructions.,Programming Skills
"Use computer-aided manufacturing (CAM) programmes to control machinery and machine tools in the creation, modification, analysis, or optimisation as part of the manufacturing processes of workpieces.",Technological Skills
"Utilise computer equipment or digital devices to facilitate quality control, data management, and communication. Follow instructions given by a computer programme, create computer files or documents.",Technological Skills
Collect contact info for all team members and decide on modes of communication.,Social Skills
"Handle customer expectations in a professional manner, anticipating and addressing their needs and desires. Provide flexible customer service to ensure customer satisfaction and loyalty.",Social Skills
Offer help and advice to service technicians in case of machine malfunctions and other repair tasks.,Social Skills
"Re-assemble transport equipment engines after overhaul, inspection, repair, maintenace or cleaning according to blueprints and technical plans.",Technological Skills
"Use appropriate questions and active listening in order to identify customer expectations, desires and requirements according to product and services.",Social Skills
Adjust designs of products or parts of products so that they meet requirements.,Technological Skills
"Analyse the training problems and identify the training requirements of an organisation or individuals, so as to provide them with instruction tailored to their prior mastery, profile, means and problem.",Thinking Skills
"Analyse, transform and model data in order to discover useful information and to support decision-making.",Digital Skills
"Analyse, understand and apply the information provided regarding technical conditions.",Thinking Skills
Assemble and prepare goods and demonstrate their functionalities to customers.,Social Skills
"Assist engineers or scientists with conducting experiments, performing analysis, developing new products or processes, constructing theory, and quality control.",Thinking Skills
"Build a model of the product out of wood, clay or other materials by using hand or electrical tools.",Technological Skills
"Check heights, colour and other attributes of finished product against specifications.",Others Skills
Check machinery and equipment to ensure reliable performance during use and operations in worksites.,Technological Skills
"Collaborate with engineers to ensure common understanding and discuss product design, development and improvement.",Social Skills
"Conduct experimental, environmental and operational tests on models, prototypes or on the systems and equipment itself in order to test their strength and capabilities under normal and extreme conditions.",Technological Skills
"Continuously check up on the automated machine's set-up and execution or make regular control rounds. If necessary, record and interpret data on the operating conditions of installations and equipment in order to identify abnormalities.",Technological Skills
"Control nuclear plant systems, such as ventilation and water draining systems, to ensure proper functioning and identify irregularities.",Technological Skills
Control that items put up for sale are correctly priced and displayed and that they function as advertised.,Others Skills
"Convey relevant scheduling information. Present the schedule to the persons concerned, and inform them of any schedule changes. Approve the schedules and verify that everyone has understood the information sent to them.",Social Skills
Correct and adjust the reliability of an electronic instrument by measuring output and comparing results with the data of a reference device or a set of standardised results. This is done in regular intervals which are set by the manufacturer and using calibration devices.,Technological Skills
"Create detailed technical plans of machinery, equipment, tools and other products.",Technological Skills
Create technical designs and technical drawings using specialised software.,Technological Skills
"Demonstrate how to use a product in a correct and safe manner, provide customers with information on the product's main features and benefits, explain operation, correct use and maintenance. Persuade potential customers to purchase items.",Social Skills
"Design engineering parts, assemblies, products, or systems.",Technological Skills
Design prototypes of products or components of products by applying design and engineering principles.,Technological Skills
"Develop testing protocols in collaboration with engineers and scientists to enable a variety of analyses such as environmental, chemical, physical, thermal, structural, resistance or surface analyses on a wide range of materials such as metals, ceramics or plastics.",Thinking Skills
"Develop testing protocols to enable a variety of analyses of products, systems, and components.",Thinking Skills
"Devise methods to determine improvement in productivity, adjusting the goals to be reached and the necessary time and resources.",Others Skills
"Display results, statistics and conclusions to an audience in a transparent and straightforward way.",Social Skills
Ensure that finished products meet or exceed company specifications.,Personal Skills
Evaluate customer's comments in order to find out whether customers feel satisfied or dissatisfied with the product or service.,Social Skills
Evaluate how much stock is used and determine what should be ordered.,Others Skills
Identifying complex problems and reviewing related information to develop and evaluate options and implement solutions.,Thinking Skills
"Improve production rates, efficiencies, yields, costs, and changeovers of products and processes by using relevant advanced, innovative, and cutting edge technology.",Technological Skills
"Interpret and analyse data collected during testing in order to formulate conclusions, new insights or solutions.",Digital Skills
"Keep records of the machine's faults, interventions and irregularities for quality control.",Others Skills
"Lead inspections and the protocol involved, such as introducing the inspection team, explaining the purpose of the inspection, performing the inspection, requesting documents, asking appropriate questions, and maintaining a high level of professionalism when investigating subjects.",Personal Skills
"Liaise with managers of other departments ensuring effective service and communication, i.e. sales, planning, purchasing, trading, distribution and technical.",Social Skills
"Maintain and repair electrical equipment, switchboards, electric motors, generators and other electrical and electronic devices used in vehicles. Detect electric malfunctions, locate faults, and take measures to prevent damage. Operate electrical testing and measuring equipment. Interpret electrical and simple electronic diagrams.",Technological Skills
Maintain equipment used for testing the quality of systems and products.,Technological Skills
"Oversee the selection, training, performance and motivation of staff.",Social Skills
Oversee the testing procedures to ensure that the end-product complies with the quality and safety requirements.,Technological Skills
"Perform tests on products' models to analyse the ability of products to endure temperature, loads, motion, vibration and other factors.",Technological Skills
"Perform tests putting a system, machine, tool or other equipment through a series of actions under actual operating conditions in order to assess its reliability and suitability to realise its tasks, and adjust settings accordingly.",Technological Skills
"Plan, coordinate, and direct all production activities to insure the goods are made on time, in correct order, of adequate quality and composition, starting from intake goods up to shipping.",Thinking Skills
"Prepare and make up regular reports on the types and amounts of fuel, oil and other accessories sold in fuel stations over a period of time.",Others Skills
"Prepare the invoice of goods sold or services provided, containing individual prices, the total charge, and the terms. Complete order processing for orders received via telephone, fax and internet and calculate the customer’s final bill.",Others Skills
Produce accurate calculations on time necessary to fulfil future technical tasks based on past and present information and observations or plan the estimated duration of individual tasks in a given project.,Thinking Skills
"Produce research documents or give presentations to report the results of a conducted research and analysis project, indicating the analysis procedures and methods which led to the results, as well as potential interpretations of the results.",Thinking Skills
"Reach an agreement with the supplier upon technical, quantity, quality, price, conditions, storage, packaging, send-back and other requirements related to the purchasing and delivering process.",Social Skills
"Read and comprehend standard blueprints, machine, and process drawings.",Technological Skills
"Read and interpret such technical resources such as digital or paper drawings and adjustment data in order to properly set up a machine or working tool, or to assemble mechanical equipment.",Technological Skills
"Read the technical drawings of a product made by the engineer in order to suggest improvements, make models of the product or operate it.",Technological Skills
Recomend product modifications and process improvements.,Personal Skills
Record data which has been identified specifically during preceding tests in order to verify that outputs of the test produce specific results or to review the reaction of the subject under exceptional or unusual input.,Others Skills
Register and handle cash transactions by using point of sale register.,Others Skills
"Survey and investigate recent trends and developments in technology. Observe and anticipate their evolution, according to current or future market and business conditions.",Thinking Skills
"Take ultimate responsibility for the safety, quality and efficiency of the production area.",Social Skills
Understand and use technical documentation in the overall technical process.,Thinking Skills
Use equipment to test performance and operation of machinery.,Technological Skills
Work closely and communicate with engineers on designs or new products.,Social Skills
Work closely with the relevant quality assurance or grading party involved.,Social Skills
 Minitab.,Technological Skills
"Check the functionality of essential components of airport vehicles and equipment such as brakes, controls, tires, and lights before releasing them for operations.",Thinking Skills
Command products from relevant suppliers to get convenient and profitable products to purchase.,Personal Skills
